{
  "plan_version": 1,
  "reviewed_spec_sha": "832be81341f2c523fd42918206774ec8a51f54de653a323ad56d612e0ea47748",
  "source_sha": "2971310441b69735cbe759293abd8c4d044bf347",
  "rows": [
    {
      "source_path": "product/npm-shrinkwrap.json",
      "target_path": "npm-shrinkwrap.json",
      "git_mode": "100644",
      "blob_oid": "ddb57d51ccadcfdaaddeaf2ad993249aa11291b7",
      "sha256": "9ffc39fa013a67517d95399c80759a4fd359ce1ab1ccc5ee0e957504796ab296",
      "size": 18940,
      "disposition": "relocated"
    },
    {
      "source_path": "product/package.template.json",
      "target_path": "package.json",
      "git_mode": "100644",
      "blob_oid": "1300679f38eaa425732c0afd9f5f6b96854ee85c",
      "sha256": "c27bff20e659dbd11131e51eb397769647ebb376a43569e1547ae6bbfa09e519",
      "size": 472,
      "disposition": "relocated",
      "transform": "add engines.npm = \"10.9.4\" (founder adjudication #3, review finding F3)",
      "target_sha256": "e7dd03dfce75c3ae4053541bb813b17f228dc6e15cec32aa268d0adbf3320736"
    },
    {
      "source_path": "product/source-boundary.v1.json",
      "target_path": "product/source-boundary.v1.json",
      "git_mode": "100644",
      "blob_oid": "91cc641e26928132fa147b31f5868f18a4ce0401",
      "sha256": "ec38f1fe752f456035c8b0232cda1864be3092dfd15c1294c9d5855834e259db",
      "size": 1371,
      "disposition": "copied"
    },
    {
      "source_path": "schemas/product/runtime-config.v1.schema.json",
      "target_path": "schemas/runtime-config.v1.schema.json",
      "git_mode": "100644",
      "blob_oid": "9e045732c3e17b6b9e360858c55fa5cf9a00472e",
      "sha256": "2af5b676bf79771a6e5b1e67d394d2e2bfdf994d3507870eebbdf0d942e93953",
      "size": 1393,
      "disposition": "relocated"
    },
    {
      "source_path": "src/capture/granola-source-policy.ts",
      "target_path": "src/capture/granola-source-policy.ts",
      "git_mode": "100644",
      "blob_oid": "8664706bde86785fad87f525a6cfbc6bafb9610b",
      "sha256": "a2d2ad902920f21ab52a41c3f895aa82efeab7488a5d4e6ffdfcb06e44ea1990",
      "size": 927,
      "disposition": "copied"
    },
    {
      "source_path": "src/capture/pipeline-core.ts",
      "target_path": "src/capture/pipeline-core.ts",
      "git_mode": "100644",
      "blob_oid": "dfa2bb254be7924bcd4cd66ad1111095494fe577",
      "sha256": "796d4552723ad1c9e09efa6de9c01716ec2eac810056eb0e47eb306d94fdfa06",
      "size": 3250,
      "disposition": "copied"
    },
    {
      "source_path": "src/capture/surfaces/granola-poller.ts",
      "target_path": "src/capture/surfaces/granola-poller.ts",
      "git_mode": "100644",
      "blob_oid": "ffd7b15f0d4d1bc36f06d37ae344ae2e793343f3",
      "sha256": "7d1ac043256510cd194613d7aaedf59c6875cf9e93d126383b34bd4ec816f713",
      "size": 35016,
      "disposition": "copied"
    },
    {
      "source_path": "src/echo-home/adapters/atomic-write.ts",
      "target_path": "src/echo-home/adapters/atomic-write.ts",
      "git_mode": "100644",
      "blob_oid": "6f1d0dedc983a52ed6d328a26b0724e1b3cc2daa",
      "sha256": "f0f8db5e3d80843cc50c82af8a88e55054c546e2343364009e6817903ce4b45e",
      "size": 5684,
      "disposition": "copied"
    },
    {
      "source_path": "src/echo-home/state-paths.ts",
      "target_path": "src/echo-home/state-paths.ts",
      "git_mode": "100644",
      "blob_oid": "bcf30e93c9648868e6ff2c8271059797e9d44773",
      "sha256": "d1c44e79d28e1d67de07ac7e349def697667d9b53a9472be7cadfaedf74bfd58",
      "size": 881,
      "disposition": "copied"
    },
    {
      "source_path": "src/enrich/granola-signals.ts",
      "target_path": "src/enrich/granola-signals.ts",
      "git_mode": "100644",
      "blob_oid": "1dc78fbc0dc0f435e7d9131dece18107c4cdf2ae",
      "sha256": "f67d1220ed8ad20e8d8d56a74e15fb28d81ee287c52cda90bbede8c6d01fd9d4",
      "size": 44845,
      "disposition": "copied"
    },
    {
      "source_path": "src/enrich/post-meeting-brief.ts",
      "target_path": "src/enrich/post-meeting-brief.ts",
      "git_mode": "100644",
      "blob_oid": "dd296741c6c8fc0af761cd67d7ed8a45cf3ed049",
      "sha256": "c96d1b820eabda063fdb0c470827a4fcf7df41009a16dd0c2927a9028a7dccf8",
      "size": 9973,
      "disposition": "copied"
    },
    {
      "source_path": "src/enrich/worker-heartbeat.ts",
      "target_path": "src/enrich/worker-heartbeat.ts",
      "git_mode": "100644",
      "blob_oid": "fe4adceb46d99704a138aaa1fed79fdef61be667",
      "sha256": "d83fbfa0db6dd3f358503ec306dea39dc40a3ecc9d5894812d14b1690a5b5014",
      "size": 3217,
      "disposition": "copied"
    },
    {
      "source_path": "src/guards.ts",
      "target_path": "src/guards.ts",
      "git_mode": "100644",
      "blob_oid": "251a4bfface223c1401441115b55f4e9b9410699",
      "sha256": "e6099d1aced802ba6125946ad7555b1b2e3ae12d89ea0034decc323410a485be",
      "size": 110,
      "disposition": "copied"
    },
    {
      "source_path": "src/logging/index.ts",
      "target_path": "src/logging/index.ts",
      "git_mode": "100644",
      "blob_oid": "6570d49a44c72d6e23c4bf35d6c0cd1570e89b8f",
      "sha256": "a6d36e7d58662ca032320d6ebdec1a2db574a7dafa4715855b2bdd2acc7e0367",
      "size": 1658,
      "disposition": "copied"
    },
    {
      "source_path": "src/product/cli.ts",
      "target_path": "src/product/cli.ts",
      "git_mode": "100644",
      "blob_oid": "5f9386140a714161540a8b97d57af78f6a43c34b",
      "sha256": "237654d882218cfe102b80c8eeb73b38f79f100ded0064a0e31be48bf66518f9",
      "size": 5138,
      "disposition": "copied"
    },
    {
      "source_path": "src/product/config.ts",
      "target_path": "src/product/config.ts",
      "git_mode": "100644",
      "blob_oid": "b1365e7902a8d4040e2ba0dc9ce240413d5fd266",
      "sha256": "017d61f602b687f20333e1ecf311a83cb18c4aa069c03b6a817ead061d22e7d5",
      "size": 7693,
      "disposition": "copied"
    },
    {
      "source_path": "src/product/index.ts",
      "target_path": "src/product/index.ts",
      "git_mode": "100644",
      "blob_oid": "7c8d171d127e6b9fa7a61c7d359de2d01c5dd11f",
      "sha256": "c002f00eca55d6e8bfe7a942eb525f0a299c102bab112b2a7304aa36ac31415e",
      "size": 1043,
      "disposition": "copied"
    },
    {
      "source_path": "src/product/paths.ts",
      "target_path": "src/product/paths.ts",
      "git_mode": "100644",
      "blob_oid": "3f765f979fee41e56a616f64217110113b2afc45",
      "sha256": "a6e36d95074975f104e558ba71478b263b07a2c09a364a0f18442cdd5f61961c",
      "size": 941,
      "disposition": "copied"
    },
    {
      "source_path": "src/product/runtime.ts",
      "target_path": "src/product/runtime.ts",
      "git_mode": "100644",
      "blob_oid": "3f034186f62377cbe8c9e7f6353736b239761e66",
      "sha256": "813bc16c1309c81886c7f6a3a197f2cabd4c1cda1ed2948ca21774ff80280950",
      "size": 7675,
      "disposition": "copied"
    },
    {
      "source_path": "src/product/spawn-sanitized-child.ts",
      "target_path": "src/product/spawn-sanitized-child.ts",
      "git_mode": "100644",
      "blob_oid": "1d9990abc28c923644a0026a81569a2d4243de07",
      "sha256": "29a0b9105fac2de573cd01e6c041b937580c66655af45dbb6ef4ec5c376c7055",
      "size": 3185,
      "disposition": "copied"
    },
    {
      "source_path": "src/storage/interface.ts",
      "target_path": "src/storage/interface.ts",
      "git_mode": "100644",
      "blob_oid": "ba954577736841e47ef1dd27e050455ee097867b",
      "sha256": "01d57b0742e2dd601de0de23abe4905b7cd1df82fd724fad394d35888af945f5",
      "size": 8025,
      "disposition": "copied"
    },
    {
      "source_path": "src/storage/migrate.ts",
      "target_path": "src/storage/migrate.ts",
      "git_mode": "100644",
      "blob_oid": "27c1e20dd5058ad524b7ce7661e7783d4119d896",
      "sha256": "e21466f7fa56c5e872599110d16054bea229b3589d0dfa81d650e85c5ec5cf7c",
      "size": 2952,
      "disposition": "copied"
    },
    {
      "source_path": "src/storage/source-match.ts",
      "target_path": "src/storage/source-match.ts",
      "git_mode": "100644",
      "blob_oid": "1f5c9228976bdc5a324934a0150e9ef672708b03",
      "sha256": "dc01582037e2e6bca906b223c273bd9687fb97965d1260ac85367ec5c9067069",
      "size": 3838,
      "disposition": "copied"
    },
    {
      "source_path": "src/storage/sqlite.ts",
      "target_path": "src/storage/sqlite.ts",
      "git_mode": "100644",
      "blob_oid": "add66d86545ae96ecb2ba486a8e447dc29ffbbc0",
      "sha256": "d5559dd1a092e26536790a7832d8ee4c64d957fd0fd343d19336f0fddbf60878",
      "size": 14594,
      "disposition": "copied"
    },
    {
      "source_path": "src/util/json.ts",
      "target_path": "src/util/json.ts",
      "git_mode": "100644",
      "blob_oid": "d354247f42c1b49dcef26e54732c648224fcaa5f",
      "sha256": "e39d9255f557e388d352bd73933b05cc30082d19525720c099e0949fb2656751",
      "size": 397,
      "disposition": "copied"
    },
    {
      "source_path": "src/util/subject.ts",
      "target_path": "src/util/subject.ts",
      "git_mode": "100644",
      "blob_oid": "ca9b8d08b3fb9c14da5464223ed58609c0cb8ae3",
      "sha256": "85d70f78278b7d27e949d7e9b898744432c18cd29b2bf88c44dc137a57fd6f7a",
      "size": 1240,
      "disposition": "copied"
    },
    {
      "source_path": "src/util/timestamp.ts",
      "target_path": "src/util/timestamp.ts",
      "git_mode": "100644",
      "blob_oid": "cea84e51ef6357a44bf8efa1aa3562feffdd4f32",
      "sha256": "c8e65b810e4ee5ab7b8b896e4ef15a1438d44bfa43c34b072cec170a58aca2ee",
      "size": 497,
      "disposition": "copied"
    },
    {
      "source_path": "tests/product/build-once-contract.test.ts",
      "target_path": "tests/product/build-once-contract.test.ts",
      "git_mode": "100644",
      "blob_oid": "08685583efc7d6008d32977d4486b6ec0068b456",
      "sha256": "9929bebe17ec72c441a20f57273ccc80f8331db5c5146363ea5befa6912c005d",
      "size": 14384,
      "disposition": "copied"
    },
    {
      "source_path": "tests/product/hermeticity.test.ts",